{
  "brief_hash": "5ba8958d",
  "created_at": "2026-06-19T23:56:14+09:00",
  "analysis_goal": "사람인 백엔드/서버 개발자 채용공고 40개를 바탕으로 회사 규모별로 원하는 사람과 요구 역량의 언어 차이를 분석한다.",
  "batch_size": 8,
  "postings": [
    {
      "posting_id": "p001",
      "company_name": "(주)비바리퍼블리카",
      "company_size": "enterprise",
      "domain": "finance",
      "domain_note": "대기업 표본. 사람인 기업정보 사원수 1,828명 기준(1,828 명 (2026년 기준)); 분류 기준: startup<=50, mid_size=51~299, scaleup(강소기업)=300~999, enterprise>=1000.",
      "role_title": "[토스페이먼츠] Server Developer (SRE)",
      "reference_link": "https://www.saramin.co.kr/zf_user/jobs/relay/view?rec_idx=54016802",
      "captured_at": "2026-06-19T23:56:14+09:00",
      "raw_text": "제목: [토스페이먼츠] Server Developer (SRE)\n회사: (주)비바리퍼블리카\n출처: 사람인 상세요강 이미지 판독\n공고 URL: https://www.saramin.co.kr/zf_user/jobs/relay/view?rec_idx=54016802\n토스페이먼츠에서 Site Reliability Engineer를 모집하고 있어요.\n\n토스페이먼츠를 소개해드려요\n- 토스페이먼츠는 사업의 어려움과 비효율을 이해하고, 기술부터 운영까지 사업에 필요한 모든 솔루션을 제공하는 것을 목표로 합니다.\n- 소비자들에게 쉽고 편한 서비스 경험을 제공하고, 가맹점에게는 오직 사업에만 집중할 수 있는 환경이 보장되는 제품을 만들고 있어요.\n- 진작 결제 시장 혁신을 핵심 목표로 자율과 책임의 원칙 아래, 강력한 상호 신뢰의 문화 속에서 일하고 있어요.\n\n합류하게 될 팀에 대해 알려드려요\n- 토스페이먼츠는 사업자들이 필요로 하는 기술적 도구를 적시에, 안정성 있게 제공하고자 합니다.\n- 이를 위해서는 제품을 빠르게, 자주 출시할 수 있는 기반을 만드는 것이 중요합니다.\n- SRE는 토스페이먼츠를 구성하는 결제 기반 코어 시스템, 코어시스템과 협업하는 수많은 서버 구성요소의 reliability, scalability, sustainability를 확보하기 위해 전사 개발팀 및 DevOps와 협업하며 시스템 안정성 및 구조적 개선 작업을 진행합니다.\n\n합류하면 함께할 업무예요\n- 장애 발생 시 문제를 해결하고, 재발 방지를 위한 개발과 설계를 주도하고 해법을 마련합니다.\n- 전사 시스템을 대상으로 한 모니터링, 장애 대응, 트러블슈팅, 알림 시스템 개선을 통해 서비스 안정성을 고도화하기 위한 활동을 합니다.\n- 서비스 품질 개선에 도움이 된다면 요청이 생기는 순간부터 응답이 나가는 순간까지 관련되는 모든 기술적 구성요소에 관심을 가지고 개선점을 찾아 서비스 개선 포인트를 식별하고 개선을 진행합니다.\n- 대규모 트래픽 환경에서 빠르게 원인을 분석할 수 있도록 모니터링 시스템을 지속적으로 개선합니다.\n\n이런 분과 함께하고 싶어요\n- Java/Kotlin, Spring Framework 관련 개발 경험과 문제 해결 능력이 있는 분이면 좋아요.\n- 성능 테스트를 통해 시스템의 가용성을 확인하고, 병목 지점을 해결할 수 있는 분이면 좋아요.\n- 리눅스 및 네트워크 시스템에 대한 깊은 이해가 있는 분을 찾아요.\n- MSA, Kubernetes, Istio, Redis, Kafka, ELK 기반의 인프라 운영 경험이 있는 분이면 좋아요.\n- Mission-Critical한 서비스 운영 환경을 즐기며 높은 책임감으로 탄탄한 서비스를 같이 만들어 갈 수 있는 분을 찾아요.\n- 변화를 두려워하지 않고 새로운 기술에 빠르게 적응하며 지속적인 성장을 원하는 분을 찾아요.\n- 빠르게 변화하는 기술을 모두 아는 엔지니어가 되기 어렵다는 점을 이해하고, 새 기술을 정확하게 이해하고 사용할 수 있으며, 동료와 업무를 진행하면서 사용해봤던 기술에 대한 이해도가 높다면 어떤 문제든 함께 풀어갈 수 있다고 믿어요.\n\n이력서는 이렇게 작성하시는 걸 추천해요\n- 기술 부문 이력 없이 특정 문제를 끝까지 파고들어 문제를 해결해본 경험을 작성해주세요.\n- 그동안의 경험을 단순 나열하는 것이 아니라, 경험 속에서의 임팩트 및 러닝 포인트를 확인하고 싶어요.\n- 서비스 안정성을 높이기 위해 스스로 문제를 찾아 해결해보려 시도한 경험이 있다면 적어주세요.\n- 운영 중인 시스템을 크게 개선한 경험, 또는 새로운 것을 도입해 생산성, 효율성 등을 향상시킨 경험이 있다면 적어주세요.\n- 대규모 트래픽이나 순간 트래픽이 급증하는 환경을 고려해 설계부터 효율성을 강조하여 개발한 경험이 있다면 적어주세요.\n- 비용효율적인 시스템을 구성하기 위한 고민의 경험을 작성해 주시면 좋아요.\n\n토스페이먼츠에서 사용하는 기술\n- Kotlin, Java, Gradle, Node.js\n- Spring Boot, Spring WebFlux, Spring Cloud, Spring Batch, Netty\n- JPA/Hibernate, MySQL, Oracle, Redis, Kafka, Elasticsearch\n- Kubernetes + Istio, AWS, Openstack\n- GoCD, ArgoCD, git, Jenkins, ELK\n\n꼭 확인해주세요\n- 이력서 및 제출 서류에 허위 사실이 발견되거나 근무 이력 등 징계사항이 확인될 경우 채용이 취소될 수 있어요.\n- 토스페이먼츠 내부에 따라 채용공지가 또는 결과 사유 해당자는 채용이 취소될 수 있어요.\n- 국가보훈대상자는 관련 법률에 의거 우대하고 있어요.\n\n토스페이먼츠의 합류 여정\n서류 접수 → 직무 인터뷰 → 문화적합성 인터뷰 → 레퍼런스 체크 → 처우 협의 → 최종 합격 및 입사\n\n함께 할 동료를 위한 한마디\n“토스페이먼츠 결제시스템은 안정성 걱정없이 믿고 사용할 수 있다는 인식을 함께 만들어와요.”\n시스템 장애나 성능 문제가 발생하지 않도록 사전 예방적인 개선 업무, 장애 발생 시 후속 개선 작업 수행, 시스템 이상징후를 탐지해 담당자에게 자동으로 공유되는 모니터링 시스템 구축 등 안정적인 서비스 개발 및 운영 기반을 만들어가고 있어요.\n성능, 안정성, 사용성 등 다양한 비기능적 요구사항을 지속적으로 개선하는 데 기여하며 토스페이먼츠 시스템은 그냥 믿고 사용해도 된다는 인식을 만들어가는 데 함께해요.\n궁금한 사항은 토스 커리어 사이트의 채용팀에 직접 문의하기를 통해 전달 부탁드립니다."
    },
    {
      "posting_id": "p002",
      "company_name": "(주)씨제이이엔엠",
      "company_size": "enterprise",
      "domain": "content",
      "domain_note": "대기업 표본. 사람인 기업정보 사원수 1,126명 기준(1,126 명 (2025년 기준)); 분류 기준: startup<=50, mid_size=51~299, scaleup(강소기업)=300~999, enterprise>=1000.",
      "role_title": "[CJ ENM] Mnet Plus_Backend Engineer_경력채용",
      "reference_link": "https://www.saramin.co.kr/zf_user/jobs/relay/view?rec_idx=53642664",
      "captured_at": "2026-06-19T23:56:14+09:00",
      "raw_text": "제목: [CJ ENM] Mnet Plus_Backend Engineer_경력채용\n회사: (주)씨제이이엔엠\n출처: 사람인 상세요강 (jobs/view .user_content)\n공고 URL: https://www.saramin.co.kr/zf_user/jobs/relay/view?rec_idx=53642664\n[CJ ENM] Mnet Plus_Backend Engineer_경력채용\n모집분야\n[CJ ENM] Mnet Plus_Backend Engineer_경력채용\n📋 주요업무\n백엔드 개발자는 Mnet Plus의 안정적이고 확장 가능한 서비스 아키텍처를\n설계하고 구현하는 역할을 담당합니다.\n- 글로벌 팬덤 플랫폼 서비스인 Mnet Plus 개발\n- 방송 이벤트, 콘서트, 투표 개발\n- 광고 수익 개선을 위한 기능 개발\n[조직/도메인 설명]\nMnet Plus Tech팀은 CJ ENM의 글로벌 K-POP OTT & 팬덤 플랫폼인 Mnet Plus의 제품 개발 및 데이터 분석을 실행하는 조직입니다.\n방송과 공연, 아티스트 IP를 기반으로 다양한 팬 경험을 디지털로 확장하며, 전 세계 K-POP 팬들이 콘텐츠를 즐기고 아티스트 IP와 상호작용하면서 새로운 가치를 창출할 수 있도록 제품을 개발합니다.\n특히 Tech팀은 대용량 트래픽과 실시간 이벤트를 처리하는 신뢰성을 기반으로 K-POP 팬덤에 맞는 앱 사용성을 완결성 있게 만들어내며 방대한 용량의 데이터를 처리해 새로운 인사이트를 만드는 등, 다양한 조직과 긴밀히 협업하여 콘텐츠와 기술을 연결하는 핵심 허브 역할을 수행하고 있습니다.\n[주요 업무 및 범위]\nMnet Plus Tech팀은 글로벌 K-POP OTT & 팬덤 플랫폼을 이끄는 조직으로, 방송·공연·아티스트 IP를 기반으로 한 다양한 팬 경험을 개발합니다.\n팀에 합류하시면 투표, 라이브·영상, 포토카드 등 핵심 기능 개발부터 유료 영상, 디지털 굿즈, 광고 등 새로운 수익 모델 구현까지 경험할 수 있으며, 전 세계 팬덤을 위한 글로벌 서비스를 직접 만들어가는 커리어 성장을 경험하시게 됩니다.\n[팀의 목표/비전]\nMnet Plus Tech팀의 비전은 “No.1 Global K-POP Platform”으로, 전 세계 팬들이 가장 사랑하고 가장 많이 찾는 K-POP 플랫폼으로 성장하는 것입니다.\n우리의 미션은 콘텐츠와 팬덤, 그리고 기술을 연결하여 팬 경험의 깊이와 가치를 극대화하는 데 있습니다.\n이를 위해 우리는 다국어와 다지역 환경에 최적화된 글로벌 확장을 추진하고, 상품 포트폴리오의 다각화를 통해 지속적인 매출 성장을 실현하고자 합니다.\n나아가 전 세계 K-POP 팬들이 적극적으로 참여할 수 있는 인터랙션을 강화하여, 누구도 경험하지 못한 차별화된 팬 경험을 제공하는 것을 목표로 하고 있습니다.\n📋 자격요건\n- Java 또는 Kotlin을 사용한 서버 개발 업무를 3년 이상 경험하신 분\n- RDBMS 또는 Nosql DB를 활용한 설계/운영 경험을 보유하신 분\n- Git 사용, 코드 리뷰에 익숙하신 분\n🏠 근무조건\n• 고용형태 : 정규직 (수습 3개월)\n• 급여 : 면접 후 결정\n• 근무지 : CJ ENM센터 (서울시 마포구 상암동)\n🎁 복지 및 혜택\nㆍ급여제도 : 장기근속수당\nㆍ선물 : 임신/출산 선물\nㆍ리프레시 : Refresh휴가, 휴가비지원\nㆍ근무 환경 : 사내 어린이집 운영, 자회사 제품할인, 안마실/안마의자\nㆍ교육/생활 : 교육비 지원, 사내동호회 운영\nㆍ출퇴근 : 통근버스 운행, 주택자금 융자, 야간교통비지급, 탄력근무제, 자율 근무제\nㆍ지원금/보험 : 건강검진, 의료비지원(본인), 각종 경조사 지원, 복지카드/포인트, 자녀학자금\n🚀 채용절차\n접수기간 : 2026년 06월 01일 ~ 2026년 06월 30일 23시 59분, 채용 시 마감\n제출서류 : 이력서, 자기소개서\n접수방법 : 홈페이지 지원\n전형절차 : 서류전형 → 코딩테스트 → 면접 전형(1차, 2차) → 평판조회, 채용검진, 처우협의 → 합격자 발표\n🛎️ 유의사항\n• 사람인에서 수집한 공고입니다. 정보 수정이 필요할 경우 고객센터 > 이메일 문의 로 문의해 주세요.\n• 정확한 상세요강은 반드시 채용 홈페이지에서 직접 확인 해 주시기 바랍니다."
    },
    {
      "posting_id": "p004",
      "company_name": "(주)더존비즈온",
      "company_size": "enterprise",
      "domain": "ai",
      "domain_note": "대기업 표본. 사람인 기업정보 사원수 1,770명 기준(1,770 명 (2026년 기준)); 분류 기준: startup<=50, mid_size=51~299, scaleup(강소기업)=300~999, enterprise>=1000.",
      "role_title": "[웹개발]더존ICT그룹 - 키컴 웹 솔루션 개발자 채용",
      "reference_link": "https://www.saramin.co.kr/zf_user/jobs/relay/view?rec_idx=54216038",
      "captured_at": "2026-06-19T23:56:14+09:00",
      "raw_text": "제목: [웹개발]더존ICT그룹 - 키컴 웹 솔루션 개발자 채용\n회사: (주)더존비즈온\n출처: 사람인 상세요강 이미지 판독\n공고 URL: https://www.saramin.co.kr/zf_user/jobs/relay/view?rec_idx=54216038\n2026 더존ICT그룹 키컴 웹개발자 채용\n접수기간: 2026.06.18(목) ~ 2026.07.05(일) 23시\n접수방법: recruit.douzone.com 지원\n\n디지털 전환(DX)을 넘어 인공지능 전환(AX) 시대로!\n더존비즈온은 기업, 금융, 커머스, 헬스케어, 공공 분야 등 Work&Life 토털 솔루션을 제공하는 대한민국 대표 ICT 그룹입니다.\n더존비즈온은 국내시장 점유율 1위 ERP를 비롯하여 AI, 금융(뱅킹), 이커머스, 디지털 헬스케어, 공공, 빅데이터 등 새로운 분야로 비즈니스 영역을 확장하여 기업의 혁신과 성장을 지원하고 있습니다.\n빠르게 변화하는 ICT 중심에서 지속가능한 성장을 함께 만들어갈 인재를 모집합니다.\n\n모집분야: 웹개발자\n담당업무: 웹솔루션 개발 및 관리\n1. B2B/B2G 솔루션 개발\n- Java/Spring Boot 프레임워크 기반 공통, 시스템 BackEnd 개발\n- 전자정부프레임워크 기반의 웹서비스 개발\n2. AI 및 신기술 융합 응용 프로그램 개발\n- AI-OCR 기술 및 QR코드를 연동한 비즈니스 로직 및 서비스 구현\n3. 시스템 운영 및 아키텍처 관리\n- 서버 운영 환경 최적화 및 지속 가능한 서비스 유지관리\n\n자격요건\n- JAVA or C#, .Net 프레임워크 기본 지식 보유자\n- JavaScript, HTML, CSS 등 웹 프레임워크 기반의 Front-End 개발 지식 보유자\n- Git 또는 SVN 등 형상관리(SCM) 툴을 이용한 소스코드 관리 능력 보유자\n- 관계형 데이터베이스(DBMS) 활용 및 쿼리 작성 가능자\n- 웹개발 업무 경력 2년 이상 보유자\n- 상기 요건 중 3개 이상 충족 시 지원 가능\n\n우대사항\n- JAVA / Spring Boot 프레임워크를 활용한 실무 개발 경험자\n- C# / .NET 기반의 솔루션 또는 웹서비스 개발 경험자\n- 다양한 오픈소스 라이브러리 및 웹 프레임워크 활용 경험자\n- 대용량 데이터 처리 및 AI 기반 응용 서비스 개발 관심 보유자\n- 관련 실무 경력 5년 이상 보유자\n\n근무지: 강촌(본사)\n모집회사: 키컴\n\n지원 우대사항\n- 세무회계/ERP 관련 자격증 소지자 우대\n- 재무빅데이터분석사(FDA, Financial big-Data Analyst) 자격증 소지자 우대\n\n지원 시 유의사항\n- 최종 지원 전 근무지, 지원분야 확인 필수(개인 부주의 지원 취소 불가)\n\n복리후생제도\n- 단체상해보험: 직원들의 안정된 근무여건 조성을 위해 기본 4대 사회보험 외 단체상해보험 가입을 지원합니다.\n- 건강관리: 정기 건강검진 실시와 사내 헬스케어센터를 운영합니다.\n- 경조지원: 경조사 발생 시 경조휴가 및 화환, 경조금 지급, 명절선물 제공 등을 시행합니다.\n- 교육지원: 정기교육, 개인별 교육, 도서구매 등을 지원합니다.\n- 사내 어린이집 운영: 직원의 일과 가정의 균형을 위해 사내 어린이집을 운영합니다.\n- 통근버스 운행: 강촌 본사 간 잠실역, 강변역, 천호역, 구리역, 태릉입구역, 상봉역, 평내호평역, 춘천지역을 운행합니다.\n- 사내 식당, 사내 카페 운영, 사내 동호회 운영 등 지원\n\n전형절차\n서류전형 → 1차 실무자 면접 → 2차 임원 면접 → 평판 및 레퍼런스 → 처우연봉 및 제반사항 → 최종합격\n\n채용일정\n- 서류전형: 높은 마감일 이후 1개월 이내에 개인 이메일 또는 채용 홈페이지에서 결과 확인 가능\n- 면접전형: 서류전형 발표 후 1개월 이내 개인 이메일 또는 채용 홈페이지에서 결과 확인 가능\n- 최종합격: 면접전형 발표 후 약 1개월 이내 개인 이메일 또는 채용 홈페이지에서 결과 확인 가능\n\n근무조건\n- 근무조건: 회사 내규에 따름 / 개인별 계약 협의\n- 근무시간: 월~금 09:00~18:00 (휴게시간 12:00~13:00)\n- 입사혜택: 4대 사회보험, 퇴직금 지급\n\n문의처: recruit@douzone.com"
    },
    {
      "posting_id": "p005",
      "company_name": "(주)안랩",
      "company_size": "enterprise",
      "domain": "ai",
      "domain_note": "대기업 표본. 사람인 기업정보 사원수 1,262명 기준(1,262 명 (2026년 기준)); 분류 기준: startup<=50, mid_size=51~299, scaleup(강소기업)=300~999, enterprise>=1000.",
      "role_title": "[안랩] 2026 연구소 집중 채용",
      "reference_link": "https://www.saramin.co.kr/zf_user/jobs/relay/view?rec_idx=54076392",
      "captured_at": "2026-06-19T23:56:14+09:00",